{
  "schema_version": 1,
  "artifact_type": "wmloop-backbone-instance",
  "instance_id": "ctrl_world_predictive_quality_pilot_v1",
  "backbone_family": "ctrl_world",
  "goal_id": "ctrl_world_predictive_quality_pilot_v1",
  "campaign_state": "pilot_draft",
  "claim_scope": "Portable Ctrl-World ACWM predictive-quality pilot template. External source, Python, model, and dataset assets must be bound and re-audited locally before launch; no measured improvement or transfer is claimed.",
  "surfaces": [
    {
      "surface_id": "model_repo",
      "role": "runtime",
      "status": "missing",
      "artifact_ref": "external/Ctrl-World-model-source",
      "required_for_closed_loop": true,
      "required_for_formal_verdict": false,
      "notes": "Bind the model-source revision that exactly matches the selected checkpoint architecture."
    },
    {
      "surface_id": "experiment_repo",
      "role": "runtime",
      "status": "missing",
      "artifact_ref": "external/Ctrl-World",
      "required_for_closed_loop": true,
      "required_for_formal_verdict": false,
      "notes": "Bind an evaluation checkout with action-conditioned replay and long-rollout evaluation."
    },
    {
      "surface_id": "goal_spec",
      "role": "constitutional",
      "status": "ready",
      "artifact_ref": "configs/goal/ctrl_world_predictive_quality_pilot_v1.yaml",
      "required_for_closed_loop": true,
      "required_for_formal_verdict": true,
      "notes": "Predictive quality and action-conditioned consistency only; downstream task success is excluded."
    },
    {
      "surface_id": "heldout_split",
      "role": "constitutional",
      "status": "ready",
      "artifact_ref": "configs/goal/ctrl_world_heldout_split.json",
      "required_for_closed_loop": true,
      "required_for_formal_verdict": true,
      "notes": "Six frozen task, episode, and seed identities are reused for paired predictive rollouts."
    },
    {
      "surface_id": "evaluator_adapter",
      "role": "constitutional",
      "status": "ready",
      "artifact_ref": "wmloop/evaluate/adapters/ctrl_world_predictive.py",
      "required_for_closed_loop": true,
      "required_for_formal_verdict": true,
      "notes": "Accepts paired-ground-truth predictive receipts and rejects downstream task-success evidence."
    },
    {
      "surface_id": "fingerprint_entry",
      "role": "adapter",
      "status": "ready",
      "artifact_ref": "wmloop/experiments/ctrl_world_fingerprint.py",
      "required_for_closed_loop": true,
      "required_for_formal_verdict": false,
      "notes": "Provides a reversible action-embedding dose hook and paired receipt-to-chart evaluator."
    },
    {
      "surface_id": "constitution_config",
      "role": "constitutional",
      "status": "ready",
      "artifact_ref": "configs/constitution/ctrl_world_predictive_quality_pilot_v1.json",
      "required_for_closed_loop": false,
      "required_for_formal_verdict": true,
      "notes": "Separates Ctrl-World ACWM predictive verdicts from optional WAM or downstream protocols."
    },
    {
      "surface_id": "constitution_freeze",
      "role": "constitutional",
      "status": "ready",
      "artifact_ref": "configs/constitution/ctrl_world_predictive_quality_pilot_v1.freeze.json",
      "required_for_closed_loop": false,
      "required_for_formal_verdict": true,
      "notes": "Deterministic verifier-affecting freeze for the public protocol packet."
    }
  ],
  "invariants": [
    "Ctrl-World is evaluated as an action-conditioned world model.",
    "Downstream task success and policy success rate cannot enter ACWM verdicts or fingerprint coordinates.",
    "Every dose uses the same checkpoint, action trajectory, task episode, seed, horizon, and paired GT evaluator.",
    "Cross-backbone reports compare target-normalized repair benefit, never raw metric values across goal schemas."
  ],
  "next_actions": [
    "Bind external runtime assets without editing the frozen constitutional files.",
    "Generate five-dose paired predictive receipts on the frozen development identities.",
    "Keep transfer claims blocked until the target-local chart and settled confirm receipts exist."
  ]
}
